### ISSUE TITLE
[app] sync will perform empty `/metadata` request if the client versions only a subset of the server's index

### ISSUE THREAD

**Issue by cfm** [freedomofpress/securedrop-client#2608]
## Description

If the server's `/index` contains keys for more resources than the client supports, their versions will (correctly) mismatch, but the client will waste a round trip on an empty `/metadata` request.

## Steps to Reproduce

https://github.com/freedomofpress/securedrop-client/pull/2562#pullrequestreview-3107558469

## Expected Behavior

The client skips an empty `/metadata` request.

## Actual Behavior

```
E..T..@.@.6..........~...M.B..y.P...Yl..POST /api/v2/metadata HTTP/1.1
authorization: Token Imp5YUZFYlRiVWg2X0JEdV9RZk1lbWRNa3hPX3pITTMxRC1aZ19mU1dRU28i.aJpADA.ZRR0Jkc-Pimz-8mcio5Vmx8Irn0
accept: application/json
content-type: application/json
accept-encoding: gzip
host: localhost:8081
content-length: 25

{"sources":[],"items":[]}
19:10:39.602628 eth0  Out IP 36f05a7c49ed.tproxy > 172.17.0.1.54398: Flags [.], ack 301, win 1002, length 0
E..(    .@.@..............~..y..M.nP...X@..
19:10:39.607471 eth0  Out IP 36f05a7c49ed.tproxy > 172.17.0.1.54398: Flags [P.], seq 1:166, ack 301, win 1002, length 165
E...    .@.@..............~..y..M.nP...X...HTTP/1.1 200 OK
Server: Werkzeug/2.2.3 Python/3.12.3
Date: Mon, 11 Aug 2025 19:10:39 GMT
Content-Type: application/json
Content-Length: 58
Connection: close


19:10:39.607507 eth0  In  IP 172.17.0.1.54398 > 36f05a7c49ed.tproxy: Flags [.], ack 166, win 1002, length 0
E..(..@.@.8..........~...M.n..z.P...X@..
19:10:39.607526 eth0  Out IP 36f05a7c49ed.tproxy > 172.17.0.1.54398: Flags [P.], seq 166:224, ack 301, win 1002, length 58
E..b    .@.@..............~..z..M.nP...Xz..{
  "items": {}, 
  "journalists": {}, 
  "sources": {}
}
```

## Comments

I think this should be as simple as making sure that at least one array is non-empty in:

https://github.com/freedomofpress/securedrop-client/blob/f6032f2efd51700e60e2e68c57399c7c864e12ee/app/src/types.ts#L59-L62
